{
  "verdict": "ALLOW",
  "taskId": "FV-P02-T001",
  "action": "Approve and activate the bounded Phase FV-P02 local Windows dictation slice",
  "toolName": "development-judge",
  "riskLevel": "high",
  "reason": "The Product Owner's explicit 2026-07-14 directive permits beginning this bounded slice. Phase 01 remains open, while all local-first, password, target-change, no-Enter, no-audio-retention, and no-telemetry invariants remain enforced.",
  "rules": [
    ".claude/judge/constitution.md: User / Product Owner has highest authority",
    "docs/product/requirements.md: FR-001, FR-003, FR-005, SEC-001, SEC-002, SEC-004, PRIV-001, PRIV-002",
    "docs/engineering/development-workflow.md: implement only an approved slice and verify before closure"
  ],
  "evidence": [
    "Product Owner directive in the conversation dated 2026-07-14",
    "docs/product/requirements.md",
    "docs/architecture/component-boundaries.md",
    "docs/architecture/recording-state-machine.md"
  ],
  "saferAlternative": "Retain the bounded CPU-only, in-memory design, disable insertion on empty or failed transcription, and provide no cloud fallback.",
  "requiredNextStep": "Implement only the approved slice, then produce build, full-test, and real local microphone/transcription evidence for final review.",
  "timestamp": "2026-07-14T16:25:12+02:00"
}
