{
  "verdict": "ALLOW",
  "taskId": "FV-P03-T001",
  "action": "Close FV-P03-T001 and declare Phase 03 technically and product-complete",
  "toolName": "development-judge",
  "riskLevel": "medium",
  "reason": "The dimension contradiction is repaired; source, contract, reviews, evidence, canonical status documents and risk register consistently describe the user-accepted 140 by 40 DIP capsule. The fresh Release build passed with zero warnings and errors, all 35 tests passed, user smoke passed, and no finding remains open.",
  "rules": [
    ".claude/judge/constitution.md: the action is scoped, permitted and evidenced",
    "CLAUDE.md P-008: the floating window retains focus safety",
    "CLAUDE.md P-014: closure is supported by tests, reviews, runtime smoke and user validation",
    "docs/engineering/definition-of-done.md: all completion conditions are satisfied"
  ],
  "evidence": [
    "RecordingCapsuleWindow.xaml defines the final 140 by 40 DIP non-activating draggable host",
    "compact-capsule-dimension-reconciliation.md reconciles the historical plan and final source",
    "dotnet-build.log records 0 warnings and 0 errors after the final adjustment",
    "dotnet-test.log records 35 passed, 0 failed and 0 skipped after the final adjustment",
    "windows-visual-smoke.md records the user's explicit acceptance",
    ".claude/runtime/active-task.json records zero open findings"
  ],
  "saferAlternative": "Retain the verified implementation and reopen visual validation only if future DPI, layout, activation or positioning behavior changes.",
  "requiredNextStep": "Mark Phase 03 complete and begin the next phase only under a new approved execution contract.",
  "timestamp": "2026-07-15T14:15:04.1041584+02:00"
}
