{
  "verdict": "ALLOW",
  "taskId": "FV-P02-T002",
  "action": "Close FV-P02-T002 and declare the reported latency and recognition issue resolved for the current local profile on the tested computer",
  "toolName": "development-judge",
  "riskLevel": "medium",
  "reason": "All contractual acceptance criteria are now evidenced. Base Q8_0 with eight threads passed the measured quality and latency gates against Base Q5_0, the Release build passed with zero warnings and errors, all 35 automated tests passed, and no findings remain open. The required post-optimization real-voice recheck was performed with the rebuilt application, and the user explicitly accepted both transcription correctness and timing. Although no numeric real-voice duration was supplied, this does not block closure because quantitative improvement is independently documented by the controlled benchmark and the remaining criterion required explicit user acceptance on real speech. The result applies only to the current profile, tested computer, and approved scope.",
  "rules": [
    "CLAUDE.md: the user retains product and phase-validation authority",
    "CLAUDE.md P-013: acceptance criteria are written and evidenced",
    "CLAUDE.md P-014: closure requires more than compilation",
    ".claude/judge/constitution.md: decisions use documented evidence",
    "docs/engineering/definition-of-done.md: criteria, tests, reviews, documentation, and findings must be complete",
    ".claude/runtime/active-task.json: one real-voice user recheck is required before claiming the quality issue resolved"
  ],
  "evidence": [
    "docs/project/evidence/phase-02-quality/real-voice-recheck.md: PASS; post-optimization transcription and timing explicitly accepted by the user",
    "docs/project/evidence/phase-02-quality/benchmark.json: Q8_0/8 threads reduced normalized errors from 17 to 15 and median inference from 4.047 to 3.457 seconds",
    "docs/project/evidence/phase-02-quality/benchmark.json: prepared product path achieved median RTF 0.5625",
    "docs/project/evidence/phase-02-quality/dotnet-build.log: Release build passed with 0 warnings and 0 errors",
    "docs/project/evidence/phase-02-quality/dotnet-test.log: 35 passed, 0 failed, 0 skipped",
    "docs/project/evidence/phase-02-quality/implementation-summary.md: status REAL_VOICE_RECHECK_ACCEPTED",
    "docs/project/phases/phase-02-quality-optimization.md: status ACCEPTED",
    ".claude/runtime/active-task.json: verification fields pass and openFindings is empty"
  ],
  "saferAlternative": "No narrower action is required; retain the benchmark and rollback path, and reopen a measured optimization task only if a future real-voice regression is reported.",
  "requiredNextStep": "Persist this verdict, mark FV-P02-T002 completed, and update canonical project state without extending the result to other hardware or untested transcription profiles.",
  "timestamp": "2026-07-14T19:13:00.8204384+02:00"
}
