{
  "verdict": "ALLOW",
  "taskId": "FV-P07-T017",
  "action": "Present Phase 07E as technically ready for closure; do not close the phase",
  "toolName": "development-judge",
  "riskLevel": "medium",
  "reason": "Phase 07E satisfies its technical and manual acceptance criteria. The pure local dashboard mapping is verified by 28 focused tests; restore, Release build, all 346 tests, 33 governance hooks, static scans, JSON validation, and diff integrity pass. The visual checklist is recorded solely as a PASS explicitly reported by the user, without invented detail. Phase 07E remains open, Phase 07D remains open with only its offline slice accepted, and no other phase status was changed.",
  "rules": [
    "This verdict confirms technical closure readiness only; it does not constitute user authority to close Phase 07E.",
    "The manual PASS must remain attributed to the user's report and may not be embellished with unreported observations or screenshots.",
    "Phase 07D and all other phase states must remain unchanged.",
    "No code, tests, dependencies, external systems, network operation, provider configuration, secrets, .env files, user data, protected governance assets, or Git state may be changed under this verdict.",
    "A separate explicit user instruction is required before a docs-only finalization may mark Phase 07E closed."
  ],
  "evidence": [
    "docs/project/evidence/phase-07e-dynamic-dashboard/phase-07e-smoke-finalization-contract.draft.json",
    "docs/project/evidence/phase-07e-dynamic-dashboard/manual-dashboard-smoke-checklist.md",
    "docs/project/evidence/phase-07e-dynamic-dashboard/plan-judge-verdict.json",
    "docs/project/evidence/phase-07e-dynamic-dashboard/development-judge-verdict.json",
    "docs/project/evidence/phase-07e-dynamic-dashboard/implementation-summary.md",
    "docs/project/evidence/phase-07e-dynamic-dashboard/review-summary.md",
    "docs/project/evidence/phase-07e-dynamic-dashboard/verification-summary.md",
    "docs/project/phases/phase-07e-dynamic-dashboard.md",
    "docs/project/project-state.md",
    "Deterministic evidence: focused tests 28/28; Release build 0 warnings/0 errors; full suite 346/346; governance hooks 33/33; scans and diff PASS.",
    "Direct user report dated 2026-07-22: visual dashboard checklist PASS."
  ],
  "saferAlternative": "Keep Phase 07E in READY_FOR_TECHNICAL_CLOSURE_REVIEW until the user explicitly authorizes closure; this is the required current state.",
  "requiredNextStep": "Present this technical closure verdict to the user and request an explicit instruction accepting and closing Phase 07E. If received, create a separate docs-only finalization contract that closes only Phase 07E, preserves Phase 07D and every other phase state, and performs no code, external, secret, data, or Git operation.",
  "timestamp": "2026-07-22T00:00:00+02:00"
}
