{
  "verdict": "ALLOW",
  "taskId": "FV-P07-T015",
  "action": "Record the user's acceptance of the Phase 07D offline slice while keeping Phase 07D open",
  "toolName": "development-judge",
  "riskLevel": "medium",
  "reason": "The user explicitly responded “je valide” to the presented offline Phase 07D implementation. The proposed contract is limited to recording that acceptance in documentation and project state. It does not claim live Gemini, deployed-backend connectivity, external configuration, or full phase closure, and it excludes code, secrets, .env files, external systems, user data, and Git mutation.",
  "rules": [
    "Record acceptance only for the verified offline FLUENT_BACKEND_URL configuration and Cloud-availability gating slice.",
    "Keep Phase 07D open; do not mark it closed, fully accepted, deployed, live-validated, or production-ready.",
    "Do not change the status of Phase 06B, 06C, 07A, 07C, or any other phase.",
    "Do not modify code, tests, dependencies, external services, backend configuration, provider credentials, secrets, .env files, user data, protected governance assets, or Git state.",
    "Any live Gemini/backend configuration, deployment, credential use, smoke test, or final Phase 07D closure requires a separate explicitly authorized contract."
  ],
  "evidence": [
    "docs/project/evidence/phase-07d-authenticated-gemini/phase-07d-offline-acceptance-contract.draft.json",
    "docs/project/evidence/phase-07d-authenticated-gemini/development-judge-verdict.json",
    "docs/project/phases/phase-07d-authenticated-gemini.md",
    "docs/project/project-state.md",
    "Direct user acceptance dated 2026-07-22: “je valide” in response to the Phase 07D offline-slice presentation."
  ],
  "saferAlternative": "Leave Phase 07D as IMPLEMENTED_AWAITING_USER_REVIEW without recording acceptance; this is unnecessary because the user's acceptance is explicit and the contract preserves all live-operation exclusions.",
  "requiredNextStep": "Record this verdict and update only the contract-listed documentation/state to mark the offline slice user-accepted while leaving Phase 07D open. Complete FV-P07-T015 after verifying no other phase status changed. Require a new plan and explicit user authority before any live backend URL, deployment, provider credential, Gemini call, external smoke test, or Phase 07D closure.",
  "timestamp": "2026-07-22T00:00:00+02:00"
}
